{
  "schema_version": "velaserve.evidence/v1",
  "run_id": "fixture-run",
  "arm": "arm-b-load-aware-p2p",
  "group_id": "01K39J6FJ4N5W7V57QK9Q0C6CF",
  "fanout_width": 2,
  "makespan_seconds": 1.5,
  "slowest_child_ttft_seconds": 0.5,
  "recomputed_prefix_tokens": 4096,
  "cell": {
    "repetition": 1,
    "prefix_regime": "near-crossover",
    "prefix_tokens": 4096,
    "output_regime": "short",
    "max_tokens": 32,
    "arrival_skew_ms": 1,
    "load_regime": "moderate",
    "cache_state": "warm-owner",
    "transport": "tcp",
    "epp_replicas": 2
  },
  "outcome": "success",
  "children": [
    {
      "request_id": "fixture-request-1",
      "target": {"id": "sim-0", "model": "test-model"},
      "ttft_seconds": 0.4,
      "latency_seconds": 1.3,
      "prompt_tokens": 4128,
      "cached_tokens": 2048,
      "output_tokens": 32,
      "outcome": "success",
      "dispatched_at": "2026-08-26T08:00:00Z",
      "first_token_at": "2026-08-26T08:00:00.4Z",
      "completed_at": "2026-08-26T08:00:01.3Z"
    },
    {
      "request_id": "fixture-request-2",
      "target": {"id": "sim-1", "model": "test-model"},
      "ttft_seconds": 0.5,
      "latency_seconds": 1.5,
      "prompt_tokens": 4128,
      "cached_tokens": 2048,
      "output_tokens": 32,
      "outcome": "success",
      "dispatched_at": "2026-08-26T08:00:00Z",
      "first_token_at": "2026-08-26T08:00:00.5Z",
      "completed_at": "2026-08-26T08:00:01.5Z"
    }
  ]
}
